{
  "schema_version": "1.0",
  "pack_ref": "pack0-culture-people@0.0.1",
  "pack_sha256": "5d3dc3922e975085ec32605cf8a8dfdc079a83fdaee3667330ccc844522e324a",
  "decision": "approved",
  "criteria_version": "DoD v1.0",
  "notes": "",
  "actor_id": "clone_engenheiro",
  "trace_id": "V011SIM_AP",
  "timestamp": "2026-01-22T15:16:21Z"
}