{
  "schema_version": "1.0",
  "pack_ref": "pack0-app-lai@0.0.1",
  "pack_sha256": "02b587852615e306fee57f613cfbb6fabfc049147d0c2d3a3131523396b7db0d",
  "decision": "approved",
  "criteria_version": "DoD v1.0",
  "notes": "",
  "actor_id": "clone_engenheiro",
  "trace_id": "V011SIM_AP",
  "timestamp": "2026-01-22T15:16:11Z"
}